{
  "eligibleForPlayback": true,
  "playId": "https://cdn.cloud.altbalaji.com/content/2017-05/2964-59117e3d02195/manifest.m3u8",
  "playbackType": "URL",
  "message": "success",
  "bundleInfo": {
    "isBundle": false,
    "isExhausted": false,
    "counter": 0
  },
  "cp": "ALTBALAJI",
  "isDrm": false,
  "showDialogue": false,
  "pbK": "hrphtacsez13",
  "contentId": "ALTBALAJI_EPISODE_1055",
  "plg": "hi"
}